{
  "package" : "org.bitbucket.askllc.fermenter.cookbook.domain",
  "name" : "SimpleDomainManager",
  "documentation" : "A collection of operations for the SimpleDomain",
  "operations" : [ {
    "name" : "GetSimpleDomainCount",
    "documentation" : "Returns the number of persistent SimpleDomains that\n\t\t\t\texist",
    "transactionAttribute" : "Supports",
    "parameters" : [ ],
    "return" : {
      "type" : "integer"
    }
  }, {
    "name" : "ReturnVoid",
    "parameters" : [ ],
    "return" : {
      "type" : "void"
    }
  }, {
    "name" : "CreateAndPropagateErrorMessages",
    "parameters" : [ {
      "name" : "numErrorMessagesToGenerate",
      "type" : "integer"
    } ],
    "return" : {
      "type" : "void"
    }
  }, {
    "name" : "SaveSimpleDomainEntityAndPropagateErrorMessages",
    "parameters" : [ {
      "name" : "targetNameValue",
      "type" : "string"
    }, {
      "name" : "numErrorMessagesToGenerate",
      "type" : "integer"
    } ],
    "return" : {
      "package" : "org.bitbucket.askllc.fermenter.cookbook.domain",
      "type" : "SimpleDomain"
    }
  }, {
    "name" : "SelectAllSimpleDomains",
    "transactionAttribute" : "Supports",
    "parameters" : [ ],
    "return" : {
      "package" : "org.bitbucket.askllc.fermenter.cookbook.domain",
      "type" : "SimpleDomain",
      "many" : true
    }
  }, {
    "name" : "DoSomethingWithPrimitiveInputs",
    "parameters" : [ {
      "name" : "inputStr",
      "type" : "string"
    }, {
      "name" : "inputInt",
      "type" : "integer"
    } ],
    "return" : {
      "type" : "void"
    }
  }, {
    "name" : "MethodWithSingleEntityAsParam",
    "documentation" : "When AeroGear deals with an object that has an id, it wants to use PUT vice POST",
    "transactionAttribute" : "Required",
    "parameters" : [ {
      "name" : "simpleDomain",
      "package" : "org.bitbucket.askllc.fermenter.cookbook.domain",
      "type" : "SimpleDomain",
      "documentation" : "An object that is a parameter"
    } ],
    "compressedWithGZip" : true,
    "return" : {
      "package" : "org.bitbucket.askllc.fermenter.cookbook.domain",
      "type" : "SimpleDomain"
    }
  }, {
    "name" : "ReturnNullEntity",
    "parameters" : [ ],
    "return" : {
      "package" : "org.bitbucket.askllc.fermenter.cookbook.domain",
      "type" : "SimpleDomain"
    }
  }, {
    "name" : "SelectAllSimpleDomainsLazySimpleDomainChild",
    "transactionAttribute" : "Supports",
    "parameters" : [ ],
    "return" : {
      "package" : "org.bitbucket.askllc.fermenter.cookbook.domain",
      "type" : "SimpleDomain",
      "many" : true
    }
  }, {
    "name" : "DeleteAllSimpleDomains",
    "parameters" : [ ],
    "return" : {
      "type" : "void"
    }
  }, {
    "name" : "EchoPlusWazzup",
    "documentation" : "Returns your string concatenated with another, perhaps\n\t\t\t\tcooler, one",
    "parameters" : [ {
      "name" : "echoRoot",
      "type" : "string"
    } ],
    "return" : {
      "type" : "string"
    }
  }, {
    "name" : "SomeBusinessOperation",
    "documentation" : "An operation that demonstrates some important business\n\t\t\t\tfunction. Returns the altered domain.",
    "parameters" : [ {
      "name" : "someBusinessEntity",
      "package" : "org.bitbucket.askllc.fermenter.cookbook.domain",
      "type" : "SimpleDomain",
      "documentation" : "The entity on which we should perform some business\n\t\t\t\t\t\toperation"
    }, {
      "name" : "otherImportantData",
      "type" : "string",
      "documentation" : "Critical data to supplement the business entity"
    } ],
    "return" : {
      "package" : "org.bitbucket.askllc.fermenter.cookbook.domain",
      "type" : "SimpleDomain"
    }
  }, {
    "name" : "CountNumInputs",
    "documentation" : "Returns the number of provided SimpleDomain entities",
    "parameters" : [ {
      "name" : "input",
      "package" : "org.bitbucket.askllc.fermenter.cookbook.domain",
      "type" : "SimpleDomain",
      "many" : true
    } ],
    "compressedWithGZip" : true,
    "return" : {
      "type" : "integer"
    }
  }, {
    "name" : "SelectAllSimpleDomainsWithPaging",
    "transactionAttribute" : "Supports",
    "parameters" : [ {
      "name" : "startPage",
      "type" : "integer",
      "documentation" : "0-based start page"
    }, {
      "name" : "pageSize",
      "type" : "integer",
      "documentation" : "Maximum number of results to return"
    } ],
    "return" : {
      "package" : "org.bitbucket.askllc.fermenter.cookbook.domain",
      "type" : "SimpleDomain",
      "many" : true
    }
  }, {
    "name" : "ReturnManyPrimitives",
    "documentation" : "Returns a list of the given size with each element containing the provided integer",
    "parameters" : [ {
      "name" : "input",
      "type" : "integer"
    }, {
      "name" : "returnListSize",
      "type" : "integer"
    } ],
    "return" : {
      "type" : "integer",
      "many" : true
    }
  }, {
    "name" : "DoSomethingAndReturnAPrimitive",
    "parameters" : [ ],
    "return" : {
      "type" : "character"
    }
  }, {
    "name" : "SelectAllSimpleDomainsByDate",
    "parameters" : [ {
      "name" : "inputDate",
      "type" : "date"
    } ],
    "return" : {
      "package" : "org.bitbucket.askllc.fermenter.cookbook.domain",
      "type" : "SimpleDomain",
      "many" : true
    }
  }, {
    "name" : "SelectAllSimpleDomainsBeforeDate",
    "parameters" : [ {
      "name" : "inputDate",
      "type" : "date"
    } ],
    "return" : {
      "package" : "org.bitbucket.askllc.fermenter.cookbook.domain",
      "type" : "SimpleDomain",
      "many" : true
    }
  }, {
    "name" : "SelectAllSimpleDomainsAfterDate",
    "parameters" : [ {
      "name" : "inputDate",
      "type" : "date"
     } ],
    "return" : {
      "package" : "org.bitbucket.askllc.fermenter.cookbook.domain",
      "type" : "SimpleDomain",
      "many" : true
    }
  }, {
    "name" : "GetCountForDate",
    "parameters" : [ {
      "name" : "inputDate",
      "type" : "date"
     } ],
    "return" : {
      "type" : "integer"
    }
  }, {
    "name" : "ReturnVoidForDateInput",
    "parameters" : [ {
      "name" : "inputDate",
      "type" : "date"
     } ],
    "return" : {
      "type" : "void"
    }
  }, {
    "name" : "SelectAllSimpleDomainsByType",
    "transactionAttribute" : "Supports",
    "parameters" : [ {
      "name" : "type",
      "type" : "string"
    } ],
    "return" : {
      "package" : "org.bitbucket.askllc.fermenter.cookbook.domain",
      "type" : "SimpleDomain",
      "many" : true
    }
  }, {
	"name" : "UpdateAllSimpleDomainChildNames",
	"transactionAttribute" : "Required",
	"documentation" : "Sets the name of each lazily loaded SimpleDomainChild attached to the given to SimpleDomain to validate the ability to interact with lazily loaded objects using JTA-style simple accessors",
	"parameters" : [ {
      "name" : "simpleDomainId",
      "type" : "string"
    }, {
      "name" : "childName",
      "type" : "string"
    } ],
    "return" : {
      "package" : "org.bitbucket.askllc.fermenter.cookbook.domain",
      "type" : "SimpleDomain"
    }
  } ]
}