{
  "package" : "org.bitbucket.askllc.fermenter.cookbook.domain",
  "name" : "EnumerationBased",
  "documentation" : "A service that uses enumerations as inputs and outputs for test purposes",
  "operations" : [ {
    "name" : "PassInSingleEnumeratedValue",
    "parameters" : [ {
      "name" : "enumeratedValue",
      "package": "org.bitbucket.askllc.fermenter.cookbook.domain",
      "type" : "SimpleDomainEnumeration",
      "documentation" : "enumeration value"
    } ],
    "return" : {
      "type" : "void",
      "pagedResponse" : false
    }
  }, {
    "name" : "ReturnSingleEnumeratedValue",
    "transactionAttribute" : "Supports",
    "parameters" : [ ],
    "return" : {
      "package": "org.bitbucket.askllc.fermenter.cookbook.domain",
      "type" : "SimpleDomainEnumeration",
      "pagedResponse" : false
    }
  }, {
    "name" : "ReturnMultipleEnumeratedValue",
    "transactionAttribute" : "Supports",
    "parameters" : [ ],
    "return" : {
      "package": "org.bitbucket.askllc.fermenter.cookbook.domain",
      "type" : "SimpleDomainEnumeration",
      "many" : true,
      "pagedResponse" : false
    }
  }, {
    "name" : "PassInMultipleEnumeratedValues",
    "parameters" : [ {
      "name" : "enumeratedValue",
      "package": "org.bitbucket.askllc.fermenter.cookbook.domain",
      "type" : "SimpleDomainEnumeration",
      "many" : true,
      "documentation" : "enumeration value"
    } ],
    "return" : {
      "type" : "void",
      "pagedResponse" : false
    }
  } ]
}